{
  "schema_version": "1.0.0",
  "report_type": "semantic_review_manifest",
  "investigation_id": "INV-000033",
  "review_seq": 3,
  "target": {
    "commit_sha": "56f13359ee7a44e6d8686a98bcf87b900047b9fd",
    "artifact_blob_shas": {
      "00_context": "a4b5cd1467d9456e14fe887862a992025e3af940",
      "10_evidence": "85b2dca5c7da3e338e8525d42004a47811cf5107",
      "20_synthesis": "be4688e3cb5d01f847e6c72d0e88cd6da56e66a9",
      "30_analysis": "5be238905a69bce92993fddb39bac1dacdf2e3fb"
    }
  },
  "reviewed_at": "2026-10-06T00:53:11Z",
  "layer_files": {
    "00_context": "review_00_000003.json",
    "10_evidence": "review_10_000003.json",
    "20_synthesis": "review_20_000003.json",
    "30_analysis": "review_30_000003.json"
  },
  "verdict": "PASS"
}
