{
  "schema_version": "1.0.0",
  "report_type": "semantic_review_manifest",
  "investigation_id": "INV-000029",
  "review_seq": 1,
  "target": {
    "commit_sha": "ad06c497771a7280da5cdc0ddd7f5d2bc8d23dfe",
    "artifact_blob_shas": {
      "00_context": "e190ba141b96a0e3ab56a944c2572d4af5835809",
      "10_evidence": "83cccda1a8073d34da670867cccba86220d400fa",
      "20_synthesis": "5394345501c7ed6897baf2fe1621c53aa9a2c524",
      "30_analysis": "960cebcd6d5ea86a428cfeedbb7e86300fd44025"
    }
  },
  "reviewed_at": "2026-09-28T05:49:47.042Z",
  "layer_files": {
    "00_context": "review_00_000001.json",
    "10_evidence": "review_10_000001.json",
    "20_synthesis": "review_20_000001.json",
    "30_analysis": "review_30_000001.json"
  },
  "verdict": "FINDINGS"
}
