{
  "schema_version": "1.0.0",
  "report_type": "semantic_review_manifest",
  "investigation_id": "INV-000031",
  "review_seq": 3,
  "target": {
    "commit_sha": "92611cbe651326b4bcc0e5d14cfdcbc2f453c833",
    "artifact_blob_shas": {
      "00_context": "ae413c1f0eeeb27c3f2b7d23977dcc5fd27a2cd8",
      "10_evidence": "82510379c93b95583fe20a4c8626cd4427c3504b",
      "20_synthesis": "3e4924f5217ae00df4630ebe442870c6c7eab0c4",
      "30_analysis": "d9088ccd885d908b2f05f5d2ad494b5d30b37a1a"
    }
  },
  "reviewed_at": "2026-09-29T06:28:09Z",
  "layer_files": {
    "00_context": "review_00_000003.json",
    "10_evidence": "review_10_000003.json",
    "20_synthesis": "review_20_000003.json",
    "30_analysis": "review_30_000003.json"
  },
  "verdict": "PASS"
}
