{
  "schema_version": "1.0.0",
  "report_type": "semantic_review_manifest",
  "investigation_id": "INV-000029",
  "review_seq": 3,
  "target": {
    "commit_sha": "db11dbd4eeeecba6cde294a1e035baa7751a6ed0",
    "artifact_blob_shas": {
      "00_context": "e190ba141b96a0e3ab56a944c2572d4af5835809",
      "10_evidence": "83cccda1a8073d34da670867cccba86220d400fa",
      "20_synthesis": "5394345501c7ed6897baf2fe1621c53aa9a2c524",
      "30_analysis": "8bfb980fcb86d4ed82b54167e6700ff7f5974cfe"
    }
  },
  "reviewed_at": "2026-09-28T08:41:25.734Z",
  "layer_files": {
    "00_context": "review_00_000003.json",
    "10_evidence": "review_10_000003.json",
    "20_synthesis": "review_20_000003.json",
    "30_analysis": "review_30_000003.json"
  },
  "verdict": "PASS"
}
